{
  "coverage": [
    {
      "input_key": "f1",
      "reviewed": true,
      "disposition": "completed"
    },
    {
      "input_key": "f2",
      "reviewed": true,
      "disposition": "completed"
    }
  ],
  "uncertainties": [],
  "questions": [],
  "result": {
    "groups": [
      {
        "local_id": "group-1",
        "title": "Работа с фильтрами",
        "summary": "Сохранение выбранных фильтров.",
        "finding_keys": [
          "f1",
          "f2"
        ],
        "considered_keys": [
          "f1",
          "f2"
        ],
        "context_keys": [],
        "conflicts": [
          {
            "local_id": "conflict-1",
            "description": "Разные ожидания от сохранения фильтров.",
            "positions": [
              {
                "description": "Нужно сохранять.",
                "finding_keys": [
                  "f1"
                ]
              },
              {
                "description": "Сохранение не требуется.",
                "finding_keys": [
                  "f2"
                ]
              }
            ]
          }
        ]
      }
    ],
    "ungrouped_finding_keys": []
  }
}
